{
  "id": "irregular-verbs-nl",
  "title": "Onregelmatige werkwoorden",
  "language": "nl",
  "version": "1.0.0",
  "source": {
    "type": "pdf-extract",
    "fileName": "lijst_onregelmatige_werkwoorden.pdf",
    "label": "Lijst onregelmatige werkwoorden",
    "sourcePages": [
      304,
      305,
      306,
      307
    ],
    "notes": [
      "Getranscribeerd uit het aangeleverde document.",
      "Deze dataset is brongetrouw opgezet en nog niet didactisch verrijkt met frequentie, leerlijnprioriteit of foutpatronen."
    ]
  },
  "verbs": [
    {
      "lemma": "bakken",
      "pastSingular": [
        "bakte"
      ],
      "pastPlural": [
        "bakten"
      ],
      "perfectum": [
        "gebakken"
      ],
      "auxiliaries": [
        "hebben"
      ],
      "notes": []
    },
    {
      "lemma": "bederven",
      "pastSingular": [
        "bedierf"
      ],
      "pastPlural": [
        "bedierven"
      ],
      "perfectum": [
        "bedorven"
      ],
      "auxiliaries": [
        "hebben",
        "zijn"
      ],
      "notes": []
    },
    {
      "lemma": "bedriegen",
      "pastSingular": [
        "bedroog"
      ],
      "pastPlural": [
        "bedrogen"
      ],
      "perfectum": [
        "bedrogen"
      ],
      "auxiliaries": [
        "hebben"
      ],
      "notes": []
    },
    {
      "lemma": "beginnen",
      "pastSingular": [
        "begon"
      ],
      "pastPlural": [
        "begonnen"
      ],
      "perfectum": [
        "begonnen"
      ],
      "auxiliaries": [
        "zijn"
      ],
      "notes": []
    },
    {
      "lemma": "begrijpen",
      "pastSingular": [
        "begreep"
      ],
      "pastPlural": [
        "begrepen"
      ],
      "perfectum": [
        "begrepen"
      ],
      "auxiliaries": [
        "hebben"
      ],
      "notes": []
    },
    {
      "lemma": "bevallen",
      "pastSingular": [
        "beviel"
      ],
      "pastPlural": [
        "bevielen"
      ],
      "perfectum": [
        "bevallen"
      ],
      "auxiliaries": [
        "zijn"
      ],
      "notes": []
    },
    {
      "lemma": "bewegen",
      "pastSingular": [
        "bewoog"
      ],
      "pastPlural": [
        "bewogen"
      ],
      "perfectum": [
        "bewogen"
      ],
      "auxiliaries": [
        "hebben"
      ],
      "notes": []
    },
    {
      "lemma": "bezoeken",
      "pastSingular": [
        "bezocht"
      ],
      "pastPlural": [
        "bezochten"
      ],
      "perfectum": [
        "bezocht"
      ],
      "auxiliaries": [
        "hebben"
      ],
      "notes": []
    },
    {
      "lemma": "bidden",
      "pastSingular": [
        "bad"
      ],
      "pastPlural": [
        "baden"
      ],
      "perfectum": [
        "gebeden"
      ],
      "auxiliaries": [
        "hebben"
      ],
      "notes": []
    },
    {
      "lemma": "bieden",
      "pastSingular": [
        "bood"
      ],
      "pastPlural": [
        "boden"
      ],
      "perfectum": [
        "geboden"
      ],
      "auxiliaries": [
        "hebben"
      ],
      "notes": []
    },
    {
      "lemma": "bijten",
      "pastSingular": [
        "beet"
      ],
      "pastPlural": [
        "beten"
      ],
      "perfectum": [
        "gebeten"
      ],
      "auxiliaries": [
        "hebben"
      ],
      "notes": []
    },
    {
      "lemma": "binden",
      "pastSingular": [
        "bond"
      ],
      "pastPlural": [
        "bonden"
      ],
      "perfectum": [
        "gebonden"
      ],
      "auxiliaries": [
        "hebben"
      ],
      "notes": []
    },
    {
      "lemma": "blazen",
      "pastSingular": [
        "blies"
      ],
      "pastPlural": [
        "bliezen"
      ],
      "perfectum": [
        "geblazen"
      ],
      "auxiliaries": [
        "hebben"
      ],
      "notes": []
    },
    {
      "lemma": "blijken",
      "pastSingular": [
        "bleek"
      ],
      "pastPlural": [
        "bleken"
      ],
      "perfectum": [
        "gebleken"
      ],
      "auxiliaries": [
        "zijn"
      ],
      "notes": []
    },
    {
      "lemma": "blijven",
      "pastSingular": [
        "bleef"
      ],
      "pastPlural": [
        "bleven"
      ],
      "perfectum": [
        "gebleven"
      ],
      "auxiliaries": [
        "zijn"
      ],
      "notes": []
    },
    {
      "lemma": "braden",
      "pastSingular": [
        "braadde"
      ],
      "pastPlural": [
        "braadden"
      ],
      "perfectum": [
        "gebraden"
      ],
      "auxiliaries": [
        "hebben"
      ],
      "notes": []
    },
    {
      "lemma": "breken",
      "pastSingular": [
        "brak"
      ],
      "pastPlural": [
        "braken"
      ],
      "perfectum": [
        "gebroken"
      ],
      "auxiliaries": [
        "hebben"
      ],
      "notes": []
    },
    {
      "lemma": "brengen",
      "pastSingular": [
        "bracht"
      ],
      "pastPlural": [
        "brachten"
      ],
      "perfectum": [
        "gebracht"
      ],
      "auxiliaries": [
        "hebben"
      ],
      "notes": []
    },
    {
      "lemma": "buigen",
      "pastSingular": [
        "boog"
      ],
      "pastPlural": [
        "bogen"
      ],
      "perfectum": [
        "gebogen"
      ],
      "auxiliaries": [
        "hebben"
      ],
      "notes": []
    },
    {
      "lemma": "denken",
      "pastSingular": [
        "dacht"
      ],
      "pastPlural": [
        "dachten"
      ],
      "perfectum": [
        "gedacht"
      ],
      "auxiliaries": [
        "hebben"
      ],
      "notes": []
    },
    {
      "lemma": "doen",
      "pastSingular": [
        "deed"
      ],
      "pastPlural": [
        "deden"
      ],
      "perfectum": [
        "gedaan"
      ],
      "auxiliaries": [
        "hebben"
      ],
      "notes": []
    },
    {
      "lemma": "dragen",
      "pastSingular": [
        "droeg"
      ],
      "pastPlural": [
        "droegen"
      ],
      "perfectum": [
        "gedragen"
      ],
      "auxiliaries": [
        "hebben"
      ],
      "notes": []
    },
    {
      "lemma": "drijven",
      "pastSingular": [
        "dreef"
      ],
      "pastPlural": [
        "dreven"
      ],
      "perfectum": [
        "gedreven"
      ],
      "auxiliaries": [
        "hebben",
        "zijn"
      ],
      "notes": []
    },
    {
      "lemma": "drinken",
      "pastSingular": [
        "dronk"
      ],
      "pastPlural": [
        "dronken"
      ],
      "perfectum": [
        "gedronken"
      ],
      "auxiliaries": [
        "hebben"
      ],
      "notes": []
    },
    {
      "lemma": "duiken",
      "pastSingular": [
        "dook"
      ],
      "pastPlural": [
        "doken"
      ],
      "perfectum": [
        "gedoken"
      ],
      "auxiliaries": [
        "hebben",
        "zijn"
      ],
      "notes": []
    },
    {
      "lemma": "dwingen",
      "pastSingular": [
        "dwong"
      ],
      "pastPlural": [
        "dwongen"
      ],
      "perfectum": [
        "gedwongen"
      ],
      "auxiliaries": [
        "hebben"
      ],
      "notes": []
    },
    {
      "lemma": "ervaren",
      "pastSingular": [
        "ervoer"
      ],
      "pastPlural": [
        "ervoeren"
      ],
      "perfectum": [
        "ervaren"
      ],
      "auxiliaries": [
        "hebben"
      ],
      "notes": []
    },
    {
      "lemma": "eten",
      "pastSingular": [
        "at"
      ],
      "pastPlural": [
        "aten"
      ],
      "perfectum": [
        "gegeten"
      ],
      "auxiliaries": [
        "hebben"
      ],
      "notes": []
    },
    {
      "lemma": "fluiten",
      "pastSingular": [
        "floot"
      ],
      "pastPlural": [
        "floten"
      ],
      "perfectum": [
        "gefloten"
      ],
      "auxiliaries": [
        "hebben"
      ],
      "notes": []
    },
    {
      "lemma": "gaan",
      "pastSingular": [
        "ging"
      ],
      "pastPlural": [
        "gingen"
      ],
      "perfectum": [
        "gegaan"
      ],
      "auxiliaries": [
        "zijn"
      ],
      "notes": []
    },
    {
      "lemma": "genezen",
      "pastSingular": [
        "genas"
      ],
      "pastPlural": [
        "genazen"
      ],
      "perfectum": [
        "genezen"
      ],
      "auxiliaries": [
        "hebben",
        "zijn"
      ],
      "notes": []
    },
    {
      "lemma": "genieten",
      "pastSingular": [
        "genoot"
      ],
      "pastPlural": [
        "genoten"
      ],
      "perfectum": [
        "genoten"
      ],
      "auxiliaries": [
        "hebben"
      ],
      "notes": []
    },
    {
      "lemma": "geven",
      "pastSingular": [
        "gaf"
      ],
      "pastPlural": [
        "gaven"
      ],
      "perfectum": [
        "gegeven"
      ],
      "auxiliaries": [
        "hebben"
      ],
      "notes": []
    },
    {
      "lemma": "gieten",
      "pastSingular": [
        "goot"
      ],
      "pastPlural": [
        "goten"
      ],
      "perfectum": [
        "gegoten"
      ],
      "auxiliaries": [
        "hebben"
      ],
      "notes": []
    },
    {
      "lemma": "glijden",
      "pastSingular": [
        "gleed"
      ],
      "pastPlural": [
        "gleden"
      ],
      "perfectum": [
        "gegl eden"
      ],
      "auxiliaries": [
        "hebben",
        "zijn"
      ],
      "notes": []
    },
    {
      "lemma": "glimmen",
      "pastSingular": [
        "glom"
      ],
      "pastPlural": [
        "glommen"
      ],
      "perfectum": [
        "geglommen"
      ],
      "auxiliaries": [
        "hebben"
      ],
      "notes": []
    },
    {
      "lemma": "graven",
      "pastSingular": [
        "groef"
      ],
      "pastPlural": [
        "groeven"
      ],
      "perfectum": [
        "gegraven"
      ],
      "auxiliaries": [
        "hebben"
      ],
      "notes": []
    },
    {
      "lemma": "hangen",
      "pastSingular": [